{
  "dataset_id": "synthetic.training-matrix",
  "features": [
    [
      -0.9,
      -1.7,
      -2.5
    ],
    [
      -0.75,
      -1.45,
      -2.3
    ],
    [
      -0.6,
      -1.35,
      -1.9500000000000002
    ],
    [
      -0.6000000000000001,
      -1.1,
      -1.6
    ],
    [
      -0.45,
      -0.85,
      -1.4000000000000001
    ],
    [
      -0.3,
      -0.75,
      -1.0499999999999998
    ],
    [
      -0.3,
      -0.5,
      -0.7
    ],
    [
      -0.15,
      -0.25,
      -0.49999999999999994
    ],
    [
      0.0,
      -0.15000000000000002,
      -0.15000000000000002
    ],
    [
      0.0,
      0.1,
      0.2
    ],
    [
      0.15,
      0.35,
      0.39999999999999997
    ],
    [
      0.3,
      0.45,
      0.75
    ],
    [
      0.3,
      0.7,
      1.0999999999999999
    ],
    [
      0.45,
      0.9500000000000001,
      1.3
    ],
    [
      0.6000000000000001,
      1.05,
      1.6500000000000001
    ],
    [
      0.6,
      1.3,
      2.0
    ],
    [
      0.75,
      1.55,
      2.2
    ],
    [
      0.9,
      1.65,
      2.55
    ]
  ],
  "labels": [
    -1.0,
    -1.0,
    -1.0,
    -1.0,
    -1.0,
    -1.0,
    -1.0,
    -1.0,
    -1.0,
    1.0,
    1.0,
    1.0,
    1.0,
    1.0,
    1.0,
    1.0,
    1.0,
    1.0
  ],
  "metadata": {
    "split": "chronological-synthetic-v1"
  },
  "run_id": "train.supervised.l2_fill_probability",
  "seed": 7,
  "transitions": []
}
