{
  "dataset_id": "synthetic.rl-transitions",
  "features": [],
  "labels": [],
  "metadata": {
    "action_space": "Discrete(3)",
    "observation_space": "Box(3)",
    "reward": "preferred-action-minus-distance-v1"
  },
  "run_id": "train.reinforcement_learning.dyna_q_pairs",
  "seed": 7,
  "transitions": [
    {
      "action": 0,
      "episode_id": "episode:0",
      "next_action": 1,
      "next_state": [
        -1.0,
        -2.0,
        -2.0
      ],
      "reward": 1.0,
      "state": [
        -2.0,
        -2.0,
        -2.0
      ],
      "step": 0,
      "terminated": false,
      "truncated": false
    },
    {
      "action": 1,
      "episode_id": "episode:0",
      "next_action": 2,
      "next_state": [
        0.0,
        -1.0,
        -2.0
      ],
      "reward": -0.5,
      "state": [
        -1.0,
        -2.0,
        -2.0
      ],
      "step": 1,
      "terminated": false,
      "truncated": false
    },
    {
      "action": 2,
      "episode_id": "episode:0",
      "next_action": 0,
      "next_state": [
        1.0,
        -1.0,
        -1.0
      ],
      "reward": -0.5,
      "state": [
        0.0,
        -1.0,
        -2.0
      ],
      "step": 2,
      "terminated": false,
      "truncated": false
    },
    {
      "action": 0,
      "episode_id": "episode:0",
      "next_action": 1,
      "next_state": [
        2.0,
        0.0,
        -1.0
      ],
      "reward": -0.6000000000000001,
      "state": [
        1.0,
        -1.0,
        -1.0
      ],
      "step": 3,
      "terminated": false,
      "truncated": false
    },
    {
      "action": 1,
      "episode_id": "episode:0",
      "next_action": 2,
      "next_state": [
        -2.0,
        0.0,
        -1.0
      ],
      "reward": -0.5,
      "state": [
        2.0,
        0.0,
        -1.0
      ],
      "step": 4,
      "terminated": false,
      "truncated": false
    },
    {
      "action": 2,
      "episode_id": "episode:0",
      "next_action": 0,
      "next_state": [
        -1.0,
        1.0,
        0.0
      ],
      "reward": -0.6000000000000001,
      "state": [
        -2.0,
        0.0,
        -1.0
      ],
      "step": 5,
      "terminated": false,
      "truncated": false
    },
    {
      "action": 0,
      "episode_id": "episode:0",
      "next_action": 1,
      "next_state": [
        0.0,
        1.0,
        0.0
      ],
      "reward": 1.0,
      "state": [
        -1.0,
        1.0,
        0.0
      ],
      "step": 6,
      "terminated": false,
      "truncated": false
    },
    {
      "action": 1,
      "episode_id": "episode:0",
      "next_action": 2,
      "next_state": [
        1.0,
        2.0,
        0.0
      ],
      "reward": 1.0,
      "state": [
        0.0,
        1.0,
        0.0
      ],
      "step": 7,
      "terminated": false,
      "truncated": false
    },
    {
      "action": 2,
      "episode_id": "episode:0",
      "next_action": 0,
      "next_state": [
        2.0,
        2.0,
        1.0
      ],
      "reward": 1.0,
      "state": [
        1.0,
        2.0,
        0.0
      ],
      "step": 8,
      "terminated": false,
      "truncated": false
    },
    {
      "action": 0,
      "episode_id": "episode:0",
      "next_action": 1,
      "next_state": [
        -2.0,
        -2.0,
        1.0
      ],
      "reward": -0.6000000000000001,
      "state": [
        2.0,
        2.0,
        1.0
      ],
      "step": 9,
      "terminated": true,
      "truncated": false
    },
    {
      "action": 1,
      "episode_id": "episode:1",
      "next_action": 2,
      "next_state": [
        -1.0,
        -2.0,
        1.0
      ],
      "reward": -0.5,
      "state": [
        -2.0,
        -2.0,
        1.0
      ],
      "step": 0,
      "terminated": false,
      "truncated": false
    },
    {
      "action": 2,
      "episode_id": "episode:1",
      "next_action": 0,
      "next_state": [
        0.0,
        -1.0,
        2.0
      ],
      "reward": -0.6000000000000001,
      "state": [
        -1.0,
        -2.0,
        1.0
      ],
      "step": 1,
      "terminated": false,
      "truncated": false
    },
    {
      "action": 0,
      "episode_id": "episode:1",
      "next_action": 1,
      "next_state": [
        1.0,
        -1.0,
        2.0
      ],
      "reward": -0.5,
      "state": [
        0.0,
        -1.0,
        2.0
      ],
      "step": 2,
      "terminated": false,
      "truncated": false
    },
    {
      "action": 1,
      "episode_id": "episode:1",
      "next_action": 2,
      "next_state": [
        2.0,
        0.0,
        2.0
      ],
      "reward": -0.5,
      "state": [
        1.0,
        -1.0,
        2.0
      ],
      "step": 3,
      "terminated": false,
      "truncated": false
    },
    {
      "action": 2,
      "episode_id": "episode:1",
      "next_action": 0,
      "next_state": [
        -2.0,
        0.0,
        -2.0
      ],
      "reward": 1.0,
      "state": [
        2.0,
        0.0,
        2.0
      ],
      "step": 4,
      "terminated": false,
      "truncated": false
    },
    {
      "action": 0,
      "episode_id": "episode:1",
      "next_action": 1,
      "next_state": [
        -1.0,
        1.0,
        -2.0
      ],
      "reward": 1.0,
      "state": [
        -2.0,
        0.0,
        -2.0
      ],
      "step": 5,
      "terminated": false,
      "truncated": false
    },
    {
      "action": 1,
      "episode_id": "episode:1",
      "next_action": 2,
      "next_state": [
        0.0,
        1.0,
        -2.0
      ],
      "reward": -0.5,
      "state": [
        -1.0,
        1.0,
        -2.0
      ],
      "step": 6,
      "terminated": false,
      "truncated": false
    },
    {
      "action": 2,
      "episode_id": "episode:1",
      "next_action": 0,
      "next_state": [
        1.0,
        2.0,
        -1.0
      ],
      "reward": -0.5,
      "state": [
        0.0,
        1.0,
        -2.0
      ],
      "step": 7,
      "terminated": false,
      "truncated": false
    },
    {
      "action": 0,
      "episode_id": "episode:1",
      "next_action": 1,
      "next_state": [
        2.0,
        2.0,
        -1.0
      ],
      "reward": -0.6000000000000001,
      "state": [
        1.0,
        2.0,
        -1.0
      ],
      "step": 8,
      "terminated": false,
      "truncated": false
    },
    {
      "action": 1,
      "episode_id": "episode:1",
      "next_action": 2,
      "next_state": [
        -2.0,
        -2.0,
        -1.0
      ],
      "reward": -0.5,
      "state": [
        2.0,
        2.0,
        -1.0
      ],
      "step": 9,
      "terminated": true,
      "truncated": false
    },
    {
      "action": 2,
      "episode_id": "episode:2",
      "next_action": 0,
      "next_state": [
        -1.0,
        -2.0,
        0.0
      ],
      "reward": -0.6000000000000001,
      "state": [
        -2.0,
        -2.0,
        -1.0
      ],
      "step": 0,
      "terminated": false,
      "truncated": false
    },
    {
      "action": 0,
      "episode_id": "episode:2",
      "next_action": 1,
      "next_state": [
        0.0,
        -1.0,
        0.0
      ],
      "reward": 1.0,
      "state": [
        -1.0,
        -2.0,
        0.0
      ],
      "step": 1,
      "terminated": false,
      "truncated": false
    },
    {
      "action": 1,
      "episode_id": "episode:2",
      "next_action": 2,
      "next_state": [
        1.0,
        -1.0,
        0.0
      ],
      "reward": 1.0,
      "state": [
        0.0,
        -1.0,
        0.0
      ],
      "step": 2,
      "terminated": false,
      "truncated": false
    },
    {
      "action": 2,
      "episode_id": "episode:2",
      "next_action": 0,
      "next_state": [
        2.0,
        0.0,
        1.0
      ],
      "reward": 1.0,
      "state": [
        1.0,
        -1.0,
        0.0
      ],
      "step": 3,
      "terminated": false,
      "truncated": false
    },
    {
      "action": 0,
      "episode_id": "episode:2",
      "next_action": 1,
      "next_state": [
        -2.0,
        0.0,
        1.0
      ],
      "reward": -0.6000000000000001,
      "state": [
        2.0,
        0.0,
        1.0
      ],
      "step": 4,
      "terminated": false,
      "truncated": false
    },
    {
      "action": 1,
      "episode_id": "episode:2",
      "next_action": 2,
      "next_state": [
        -1.0,
        1.0,
        1.0
      ],
      "reward": -0.5,
      "state": [
        -2.0,
        0.0,
        1.0
      ],
      "step": 5,
      "terminated": false,
      "truncated": false
    },
    {
      "action": 2,
      "episode_id": "episode:2",
      "next_action": 0,
      "next_state": [
        0.0,
        1.0,
        2.0
      ],
      "reward": -0.6000000000000001,
      "state": [
        -1.0,
        1.0,
        1.0
      ],
      "step": 6,
      "terminated": false,
      "truncated": false
    },
    {
      "action": 0,
      "episode_id": "episode:2",
      "next_action": 1,
      "next_state": [
        1.0,
        2.0,
        2.0
      ],
      "reward": -0.5,
      "state": [
        0.0,
        1.0,
        2.0
      ],
      "step": 7,
      "terminated": false,
      "truncated": false
    },
    {
      "action": 1,
      "episode_id": "episode:2",
      "next_action": 2,
      "next_state": [
        2.0,
        2.0,
        2.0
      ],
      "reward": -0.5,
      "state": [
        1.0,
        2.0,
        2.0
      ],
      "step": 8,
      "terminated": false,
      "truncated": false
    },
    {
      "action": 2,
      "episode_id": "episode:2",
      "next_action": 0,
      "next_state": [
        -2.0,
        -2.0,
        -2.0
      ],
      "reward": 1.0,
      "state": [
        2.0,
        2.0,
        2.0
      ],
      "step": 9,
      "terminated": true,
      "truncated": false
    }
  ]
}
